{
  "$schema": "http://json-schema.org/draft-07/schema#",
  "$id": "https://github.com/limbpuma/qa-gate/schemas/pack.schema.json",
  "title": "qa-gate sector pack",
  "description": "Profession-specific duties German law adds on top of the generic Impressum/Datenschutz rules (lib/web/legal/packs/<sector>.json). Every pattern names the law it comes from; `manual` lists duties no tool can verify; `pruefen` lists the open questions for a lawyer. Validated by scripts/validate-packs.mjs.",
  "type": "object",
  "additionalProperties": false,
  "required": ["sector", "title", "reviewedAt", "sources", "impressumPatterns", "statements", "requiredLinks", "forbiddenWords", "manual", "pruefen"],
  "properties": {
    "sector": { "type": "string", "pattern": "^[a-z][a-z0-9-]*$", "description": "Equals the file name without .json; the value of legal.sector in qa-gate.config.json." },
    "title": { "type": "string", "minLength": 3, "description": "Human name of the profession, German." },
    "reviewedAt": { "type": "string", "pattern": "^\\d{4}-\\d{2}-\\d{2}$", "description": "Date the sources were last read (YYYY-MM-DD)." },
    "sources": { "type": "array", "minItems": 1, "items": { "type": "string", "format": "uri" }, "description": "Official sources: gesetze-im-internet.de, the Kammer, the supervising authority." },
    "impressumPatterns": { "type": "array", "items": { "$ref": "#/definitions/regexItem" }, "description": "Patterns the Impressum text must contain (Kammer, register, Aufsichtsbehörde, Haftpflicht …)." },
    "statements": { "type": "array", "items": { "$ref": "#/definitions/pagedRegexItem" }, "description": "Statements that must appear on the given pages (Erstinformation, Preisangaben, DSGVO Art. 9 …)." },
    "requiredLinks": { "type": "array", "items": { "$ref": "#/definitions/linkItem" }, "description": "Links that must exist somewhere on the audited pages (berufsrechtliche Regelungen, Register)." },
    "forbiddenWords": { "type": "array", "items": { "$ref": "#/definitions/pagedRegexItem" }, "description": "Advertising wording the profession may not use (HWG, UWG, StBerG …)." },
    "manual": { "type": "array", "items": { "type": "string" }, "description": "Duties the gate cannot verify; they go into the evidence bundle for the human reviewer." },
    "pruefen": { "type": "array", "items": { "type": "string" }, "description": "Open legal questions a lawyer must settle before selling the sector as 'konform'." }
  },
  "definitions": {
    "severity": { "type": "string", "enum": ["FAIL", "WARN"] },
    "pages": {
      "type": "array",
      "items": { "type": "string", "pattern": "^(impressum|datenschutz|agb|start|any|/.*)$" },
      "description": "Where to look: a named legal page, the start page, any audited page, or a concrete route such as /preise."
    },
    "regexItem": {
      "type": "object",
      "additionalProperties": false,
      "required": ["id", "regex", "law", "severity"],
      "properties": {
        "id": { "type": "string", "pattern": "^[a-z0-9][a-z0-9-]*$" },
        "regex": { "type": "string", "minLength": 1, "description": "JavaScript regular expression, matched case-insensitively against the page text." },
        "law": { "type": "string", "minLength": 3, "description": "Statute and paragraph, e.g. 'DDG § 5 Abs. 1 Nr. 3'." },
        "severity": { "$ref": "#/definitions/severity" },
        "note": { "type": "string" }
      }
    },
    "pagedRegexItem": {
      "type": "object",
      "additionalProperties": false,
      "required": ["id", "regex", "law", "severity"],
      "properties": {
        "id": { "type": "string", "pattern": "^[a-z0-9][a-z0-9-]*$" },
        "regex": { "type": "string", "minLength": 1 },
        "pages": { "$ref": "#/definitions/pages" },
        "law": { "type": "string", "minLength": 3 },
        "severity": { "$ref": "#/definitions/severity" },
        "note": { "type": "string" }
      }
    },
    "linkItem": {
      "type": "object",
      "additionalProperties": false,
      "required": ["id", "hrefRegex", "law", "severity"],
      "properties": {
        "id": { "type": "string", "pattern": "^[a-z0-9][a-z0-9-]*$" },
        "hrefRegex": { "type": "string", "minLength": 1, "description": "Matched against href attributes of every audited page." },
        "law": { "type": "string", "minLength": 3 },
        "severity": { "$ref": "#/definitions/severity" },
        "note": { "type": "string" }
      }
    }
  }
}
